ID	Statement	Label (0 is False)	Source	Region	Date 	Link	Comments	Original text
8	chicken and beef have been injected with prion proteins, nanoparticles or other material that make them stick to fridge magnets	0	AFP FactCheck	NORTH AMERICA	22 June 2021	https://factcheck.afp.com/misleading-claims-about-magnetism-spread-meat-poultry		
9	Romana Didulo has been appointed head of state and commander-in-chief of the “Republic of Canada.”	0	AFP FactCheck	NORTH AMERICA	18 June 2021	https://factcheck.afp.com/canada-still-headed-justin-trudeau-and-queen-elizabeth-ii		
10	Dasani bottled water contains the same compound used to kill inmates on death row	0	AFP FactCheck	NORTH AMERICA	18 June 2021	https://factcheck.afp.com/dasani-water-has-safe-amounts-potassium-chloride		
11	The Walt Disney Company tried to copyright the Swahili phrase “Hakuna Matata,” the Mexican holiday Dia de los Muertos, and most recently the Norse god Loki	0	AFP FactCheck	NORTH AMERICA	25 June 2021	https://factcheck.afp.com/disney-did-not-copyright-norse-god		
12	Covid-19 vaccines could contain trackers, citing a video showing a positive reading when a device designed to detect pet chips is held over the arm of a vaccinated woman	0	AFP FactCheck	NORTH AMERICA	02 July 2021	https://factcheck.afp.com/covid-19-vaccines-do-not-contain-tracking-devices		
13	"Covid-19 vaccines contain robotic ""nanotechnology"" that can change people's DNA"	0	AFP FactCheck	NORTH AMERICA	14 July 2021	https://factcheck.afp.com/http%253A%252F%252Fdoc.afp.com%252F9EV3G3-1		
14	people who have received a Covid-19 shot are ineligible to donate plasma to the American Red Cross because the vaccine destroys antibodies	0	AFP FactCheck	NORTH AMERICA	27 May 2021	https://factcheck.afp.com/american-red-cross-accepts-plasma-donations-covid-19-vaccine-recipients		
15	Hamas, the Gaza Strip’s Islamist rulers, bought “weapons of mass destruction” with $150 million provided by US President Joe Biden	0	AFP FactCheck	NORTH AMERICA	27 May 2021	https://factcheck.afp.com/us-funded-agency-palestinian-refugees-not-hamas		
16	a whistleblower revealed that millions of votes were changed to favor President Joe Biden by election technology company Dominion, with some attributing the information to former New York City mayor Rudy Giuliani	0	AFP FactCheck	NORTH AMERICA	26 May 2021	https://factcheck.afp.com/new-false-claim-2020-election-fraud-targets-dominion		
17	 Black Lives Matter tweeted support for Hamas, the Islamist rulers of Gaza, who are designated as a terrorist group by the United States	0	AFP FactCheck	NORTH AMERICA	24 May 2021	https://factcheck.afp.com/black-lives-matter-did-not-voice-support-hamas		
18	US space agency NASA warned an asteroid is on path to hit Earth and cannot be stopped by nuclear weapons	0	AFP FactCheck	NORTH AMERICA	18 May 2021	https://factcheck.afp.com/nasa-did-not-warn-real-asteroid-path-hit-earth		
19	US Census Bureau figures show that nearly four million fewer voters cast ballots in the 2020 presidential election than the official tally, raising questions about the integrity of the result	0	AFP FactCheck	NORTH AMERICA	14 May 2021	https://factcheck.afp.com/census-bureau-voter-tally-self-reported-not-official-election-data		
20	US House Speaker Nancy Pelosi thanked “millions of babies for sacrificing their lives for women’s rights”	0	AFP FactCheck	NORTH AMERICA	6 May 2021	https://factcheck.afp.com/nancy-pelosi-did-not-thank-babies-sacrificing-their-lives-womens-rights		
21	President Joe Biden’s climate plan would require Americans to cut red meat consumption by 90 percent	0	AFP FactCheck	NORTH AMERICA	29 April 2021	https://factcheck.afp.com/bidens-climate-plan-does-not-target-us-meat-consumption		
22	 plywood is expensive because it is being used to protect storefronts during the 2021 US protests	0	AFP FactCheck	NORTH AMERICA	23 April 2021	https://factcheck.afp.com/plywood-price-due-high-construction-demand-not-protests		
23	canola oil -- an ingredient in plant-based alternatives to meat -- is toxic	0	AFP FactCheck	NORTH AMERICA	20 April 2021	https://factcheck.afp.com/canola-oil-used-meat-substitutes-safe		
24	a medical examiner said George Floyd’s death should be ruled an overdose	0	AFP FactCheck	NORTH AMERICA	16 April 2021	https://factcheck.afp.com/doctor-did-not-say-george-floyds-death-should-be-ruled-overdose		
25	 Bill Gates has purchased the encrypted messaging app Telegram	0	AFP FactCheck	NORTH AMERICA	13 April 2021	https://factcheck.afp.com/bill-gates-has-not-bought-telegram-messaging-app		
26	nearly $50 million United Nations humanitarian aid package to Ecuador was conditional on the South American country legalizing abortions	0	AFP FactCheck	LATIN AMERICA	22 May 2020	https://factcheck.afp.com/un-falsely-accused-demanding-ecuador-legalize-abortions-get-covid-19-aid		
27	In the constitutional referendum in Chile, those who vote for the “Rejection” option must mark it with a red pencil, while those who vote “I approve” must do so with blue.	0	AFP FactCheck	LATIN AMERICA	25 October 2020	https://factual.afp.com/en-el-plebiscito-en-chile-solo-se-puede-votar-con-lapiz-pasta-azul		en el plebiscito constitucional en Chile quienes voten por la opción “Rechazo” la deben marcar con lápiz rojo, mientras que las personas que voten “Apruebo” lo deben hacer con color azul
28	A kit with medications such as azithromycin and hydroxychloroquine is distributed by the Brazilian government to patients with covid-19	0	AFP FactCheck	LATIN AMERICA	16 September 2020	https://factual.afp.com/este-kit-anticovid-no-es-distribuido-por-el-estado-brasileno		un kit con medicamentos como azitromicina e hidroxicloroquina ha sido compartida cientos de veces en redes sociales desde fines de agosto con la afirmación de que el gobierno brasileño lo reparte a pacientes con covid-19
29	Uruguay was the only country in South America that did not have open television broadcasting of its soccer team's matches for the Qatar 2022 World Cup qualifiers.	0	AFP FactCheck	LATIN AMERICA	20 November 2020	https://factual.afp.com/uruguay-ecuador-y-bolivia-no-emitieron-por-tv-abierta-los-partidos-de-su-seleccion		 Uruguay fue el único país de Sudamérica que no contó con transmisión televisiva abierta de los partidos de su selección de fútbol por las clasificatorias al Mundial de Catar 2022 
30	an example of “love jihad”, a conspiracy that alleges Muslim men in India seduce Hindu women to convert them to Islam	0	AFP FactCheck	LATIN AMERICA	03 December 2020	https://factcheck.afp.com/viral-video-couple-gym-trinidad-circulates-false-claim-about-love-jihad-india		
31	the infrared thermometer, widely used in public spaces amid the COVID-19 pandemic, can damage the pineal gland, located in the brain	0	AFP FactCheck	LATIN AMERICA	20 August 2020	https://checamos.afp.com/medir-temperatura-com-um-termometro-infravermelho-nao-danifica-glandula-pineal		o termômetro infravermelho, amplamente utilizado em espaços públicos em meio à pandemia de COVID-19, pode danificar a glândula pineal, localizada no cérebro
32	Cuba, Argentina and Venezuela do not have any financial subsidy to help their population during the covid-19 pandemic, unlike the Brazilian emergency aid	0	AFP FactCheck	LATIN AMERICA	17 September 2020	https://checamos.afp.com/argentina-e-venezuela-pagam-auxilio-emergencial-e-cuba-cobre-salarios-durante-pandemia		Cuba, Argentina e Venezuela não possuem qualquer subsídio financeiro para ajudar sua população durante a pandemia de covid-19, ao contrário do auxílio emergencial brasileiro
33	The medicine paracetamol P-500 contains the 'Machupo' virus	0	AFP FactCheck	LATIN AMERICA	31 August 2020	https://factual.afp.com/el-virus-machupo-no-puede-sobrevivir-en-una-tableta-de-paracetamol		"El medicamento paracetamol P-500 ""contiene el virus 'Machupo'"""
34	The Ecuadorian fiscal general Diana Salazar was declared by the United Nations Organization “as an accomplice to corruption” in the country of Ecuador	0	AFP FactCheck	LATIN AMERICA	13 August 2020	https://factual.afp.com/la-onu-no-declaro-complice-de-corrupcion-la-fiscal-general-de-ecuador-diana-salazar		"la fiscal general ecuatoriana Diana Salazar fue declarada por la Organización de Naciones Unidas “como cómplice de la corrupción"" en el país Ecuador"
35	Lionel Messi is boycotting a match against Israel because he refuses to play “against people who kill innocent Palestinian children”.	0	AFP FactCheck	LATIN AMERICA	25 May 2021	https://factcheck.afp.com/fabricated-quote-attributed-football-star-lionel-messi-has-been-circulating-online-2018		
36	Haiti's first lady Martine Moise died after a July 7, 2021 attack that killed her husband the president	0	AFP FactCheck	LATIN AMERICA	07 July 2021	https://factcheck.afp.com/http%253A%252F%252Fdoc.afp.com%252F9EB8C9-1		
37	US President Joe Biden authorized a US military intervention in Haiti on July 7, 2021, the day the Caribbean country's president was assassinated.	0	AFP FactCheck	LATIN AMERICA	13 July 2021	https://factcheck.afp.com/http%253A%252F%252Fdoc.afp.com%252F9EU6A2-1		
38	After thousands of Cubans marched in anti-government protests, President Miguel Diaz-Canel announced he would resign in a televised broadcast on July 17.	0	AFP FactCheck	LATIN AMERICA	26 July 2021	https://factcheck.afp.com/http%253A%252F%252Fdoc.afp.com%252F9FH4XQ-1		
39	ivermectin, an antiparasitic medicine, is a useful treatment against covid-19, and a “miracle” medicine	0	AFP FactCheck	LATIN AMERICA	18 June 2021	https://checamos.afp.com/eficacia-da-ivermectina-contra-covid-19-nao-foi-demonstrada-cientificamente		 ivermectina, um medicamento antiparasitário, como um tratamento útil contra a covid-19, e até mesmo como um remédio “milagroso”
40	 covid-19 masks hide parasites inside	0	AFP FactCheck	LATIN AMERICA	19 April 2021	https://checamos.afp.com/os-fios-pretos-dentro-das-mascaras-nao-sao-parasitas-mas-fibras-texteis-inofensivas		as máscaras contra covid-19 escondem parasitas em seu interior 
41	supposed “anti-sex beds” made of cardboard were used in the Olympic Village as an apparent measure to avoid contagion of covid-19 during the Tokyo 2020 Olympic Games	0	AFP FactCheck	LATIN AMERICA	22 July 2021	https://factual.afp.com/http%253A%252F%252Fdoc.afp.com%252F9FN7AG-1		 las supuestas “camas anti-sexo” hechas de cartón en la Villa Olímpica, como una aparente medida para evitar contagios de covid-19 durante los Juegos Olímpicos de Tokio 2020
42	Drinking just a glass of water at specific times of the day can prevent multiple health problems, such as strokes and heart attacks.	0	AFP FactCheck	LATIN AMERICA	23 February 2021	https://checamos.afp.com/beber-agua-em-horarios-especificos-nao-evita-derrames-ou-ataques-cardiacos-dizem-especialistas		Beber apenas um copo d’água em horários específicos do dia pode evitar múltiplos problemas de saúde, como derrames e ataques cardíacos
43	drinking onion juice prevents the development of any prostate problems	0	AFP FactCheck	LATIN AMERICA	12 February 2021	https://checamos.afp.com/beber-suco-de-cebola-nao-impede-o-desenvolvimento-de-problemas-na-prostata		beber suco de cebola impede o desenvolvimento de qualquer problema na próstata
44	Extreme oral hygiene, including rinsing with alcoholic beverages, allows patients to recover from Covid-19	0	AFP FactCheck	LATIN AMERICA	28 October 2021	https://factual.afp.com/tener-una-buena-higiene-bucal-no-previene-ni-cura-el-covid-19		extremar la higiene bucal, inclusive con enjuagues con bebidas alcohólicas, permite a los pacientes recuperarse del covid-19
45	car manufacturer Ford leaving Brazil would have been part of a “global decision” taken two years ago to end production of all passenger vehicles worldwide	0	AFP FactCheck	LATIN AMERICA	26 January 2021	https://checamos.afp.com/nao-ha-registro-de-que-ford-tenha-encerrado-globalmente-producao-de-veiculos-de-passageiros		o anúncio da fabricante automobilística Ford de sair do Brasil teria feito parte de uma “decisão global” tomada há dois anos de encerrar a produção de veículos de passageiros
46	a technique known as postural drainage can replace mechanical ventilation in patients with covid-19	0	AFP FactCheck	LATIN AMERICA	25 February 2021	https://checamos.afp.com/postura-de-brucos-aumenta-oxigenacao-mas-nao-substitui-respiradores-contra-covid-19		uma técnica conhecida como drenagem postural pode substituir a ventilação mecânica em pacientes com covid-19
47	Bananas with green stems and brown spots were ripened “through a chemical process”, while those with black stems were ripened “in a natural way”	0	AFP FactCheck	LATIN AMERICA	9 October 2021	https://factual.afp.com/las-manchas-de-los-platanos-indican-el-nivel-de-maduracion-y-no-intervencion-quimica		los plátanos con tallo verde y manchas marrones fueron madurados “a través de un proceso químico”, mientras que los que tienen tallo negro lo hicieron “de manera natural”
48	In Chile, if the “Approve” option wins by 80% in the October 25 referendum , it is possible to request the resignation of the president, Sebastián Piñera.	0	AFP FactCheck	LATIN AMERICA	23 September 2020	https://factual.afp.com/el-plebiscito-del-25-de-octubre-de-2020-en-chile-no-contempla-revocar-al-presidente-pinera		en Chile gana la opción “Apruebo” por un 80% en el plebiscito del próximo 25 de octubre se puede pedir la renuncia del presidente, Sebastián Piñera
49	In the United States “they have a qualified vote” and anyone who has not completed secondary school or receives social plans is not authorized to vote.	0	AFP FactCheck	LATIN AMERICA	11 September 2020	https://factual.afp.com/en-eeuu-no-hay-voto-calificado-no-se-inhabilita-al-votante-si-recibe-subsidios-ni-por-su-nivel		en Estados Unidos “tienen voto calificado” y que quien no haya hecho la escuela secundaria o cobre planes sociales no está habilitado para votar, requisitos que, aseguran los usuarios, si se aplicaran en Argentina lograrían que “el peronismo no gane nunca más”. 
50	Out of “193 countries in the world”, electronic voting machines are only used in two nations besides Brazil: Cuba and Venezuela	0	AFP FactCheck	LATIN AMERICA	18 Janeiro 2021	https://checamos.afp.com/o-preco-da-coronavac-e-inferior-ao-pago-em-varios-paises-por-outros-imunizantes-contra-covid-19		de “193 países no mundo”, as urnas eletrônicas são utilizadas apenas em duas nações além do Brasil: Cuba e Venezuela
51	people dressed as mimes and black birds depict a satanic ritual on the margins of the G7 summit in England	0	AFP FactCheck	EUROPE	15 June 2021	https://factcheck.afp.com/purported-satanic-ritual-g7-summit-was-climate-protest		
52	 Sweden stopped using PCR tests for diagnosing Covid-19 as these tests are purportedly unable to detect contagiousness	0	AFP FactCheck	EUROPE	04 June 2021	https://factcheck.afp.com/online-posts-falsely-claim-sweden-stopped-using-pcr-tests-covid-19-may-2021		
53	World Economic Forum founder Klaus Schwab purportedly wrote billions will die from 'organized epidemics'.	0	AFP FactCheck	EUROPE	07 July 2021	https://factcheck.afp.com/http%253A%252F%252Fdoc.afp.com%252F9DZ4PF-1		
54	British Prime Minister Boris Johnson and US Secretary of State Mike Pompeo have expressed support for the secession of Biafra -- a collection of states from southeast Nigeria -- from the rest of the country	0	AFP FactCheck	EUROPE	9 October 2020	https://factcheck.afp.com/false-quotes-claim-boris-johnson-and-mike-pompeo-express-support-nigerian-separatists		
55	a study by US-based scientists analysed spike proteins of the novel coronavirus. The study is evidence that some Covid-19 vaccines could be harmful.	0	AFP FactCheck	EUROPE	13 May 2021	https://factcheck.afp.com/posts-misrepresent-us-study-dangers-coronavirus-spike-protein		
56	the US Supreme Court “overturned” mandatory vaccination following a lawsuit filed by attorney Robert F. Kennedy Jr.	0	AFP FactCheck	EUROPE	23 April 2021	https://factcheck.afp.com/us-supreme-court-did-not-rule-against-mandatory-vaccination		
57	the Russian government has required polygamy for its male citizens	0	AFP FactCheck	EUROPE	23 April 2021	https://factcheck.afp.com/false-claim-circulates-social-media-russia-requires-male-citizens-have-more-one-wife		
58	British naturalist David Attenborough criticised Israel's role in the conflict with Palestinian armed groups.	0	AFP FactCheck	EUROPE	31 May 2021	https://factcheck.afp.com/david-attenborough-subject-fabricated-quote-israel-hamas-conflict		
59	"seven countries, including the United States, Spain, Italy and the United Kingdom, have ""survival rates"" of more than 99.9 percent for people who contract the novel coronavirus"	0	AFP FactCheck	EUROPE	29 May 2020	https://factcheck.afp.com/coronavirus-survival-rates-remain-unknown-experts-say		
60	photos showing President Muhammadu Buhari meeting his French counterpart Emmanuel Macron in Paris on May 17, 2021, were manipulated	0	AFP FactCheck	EUROPE	18 May 2021	https://factcheck.afp.com/nigerian-separatist-leader-falsely-claims-photos-president-meeting-french-counterpart-are-doctored		
61	Swedish climate activist Greta Thunberg urged Chinese people to stop using traditional chopsticks in order to save trees	0	AFP FactCheck	EUROPE	23 April 2021	https://factcheck.afp.com/greta-thunberg-did-not-urge-chinese-people-stop-using-chopsticks-save-trees-0		
62	prestigious British university may pull sheet music from the curriculum due to its ties to white supremacy	0	AFP FactCheck	EUROPE	09 April 2021	https://factcheck.afp.com/oxford-university-not-canceling-sheet-music		
63	France will ban the halal slaughter of chicken	0	AFP FactCheck	EUROPE	31 March 2021	https://factcheck.afp.com/france-did-not-ban-halal-slaughter-poultry		
64	Denmark has passed a new law that prohibits Muslims from voting in the elections	0	AFP FactCheck	EUROPE	11 March 2021	https://factcheck.afp.com/social-media-posts-falsely-claim-denmark-passed-law-banning-its-muslim-voters		
65	Germany’s renewable energy supply failed after snow covered solar panels and wind turbines froze	0	AFP FactCheck	EUROPE	19 February 2021	https://factcheck.afp.com/german-solar-wind-power-did-not-fail-cold-weather		
66	"Italian law enforcement ""arrested scores of paedophile cardinals"" in Vatican City"	0	AFP FactCheck	EUROPE	19 February 2021	https://factcheck.afp.com/fabricated-report-falsely-claims-italian-police-arrested-scores-paedophile-cardinals-vatican		
67	tests on a stolen sample of an unspecified vaccine showed it is radioactive enough to cause “disease and genetic damage,” and speculates that it could contain radium. 	0	AFP FactCheck	EUROPE	29 January 2021	https://factcheck.afp.com/radioactive-vaccine-was-not-stolen-german-medical-institute		
68	Pope Francis was arrested on January 9, 2021 on 80 count indictment for Child Trafficking, Fraud	0	AFP FactCheck	EUROPE	14 January 2021	https://factcheck.afp.com/no-pope-was-not-arrested-child-trafficking		
69	Austria has banned Muslims from engaging in politics	0	AFP FactCheck	EUROPE	08 January 2021	https://factcheck.afp.com/controversial-austrian-bill-does-not-involve-banning-muslims-politics		
70	Pfizer researcher found that the company’s Covid-19 vaccine will lead to infertility in women 	0	AFP FactCheck	EUROPE	9 December 2020	https://factcheck.afp.com/covid-19-vaccine-not-shown-cause-female-sterilization		
71	Dominion Voting had servers confiscated in Germany by the US military	0	AFP FactCheck	EUROPE	23 November 2020	https://factcheck.afp.com/dominion-voting-servers-were-not-seized-germany		
72	French football player Paul Pogba has retired from the international game in protest against French President Emmanuel Macron’s recent comments about radical Islam. 	0	AFP FactCheck	EUROPE	28 October 2020	https://factcheck.afp.com/paul-pogba-has-not-quit-frances-national-football-team-over-presidents-remarks-islam		
73	"controversial quotes made by Russian President Vladimir Putin criticising the lifestyle of  ""rich Africans""."	0	AFP FactCheck	EUROPE	15 October 2020	https://factcheck.afp.com/no-evidence-behind-claims-vladimir-putin-made-statement-criticising-rich-africans		
74	the word “hangover” is derived from the historic practice frequented by British sailors during the reign of Queen Victoria, who bought “access to bend over a rope” after a heavy night of drinking 	0	AFP FactCheck	EUROPE	16 September 2020	https://factcheck.afp.com/false-claim-circulates-online-hangover-term-derived-historic-practice-sleeping-rope	This one of the less impactful false claims we have	
75	Swiss authorities have “officially confirmed” that the polymerase chain reaction (PCR) test used to diagnose novel coronavirus is “fake”	0	AFP FactCheck	EUROPE	11 September 2020	https://factcheck.afp.com/hoax-circulates-online-switzerland-has-officially-confirmed-coronavirus-tests-are-fake		
76	The novel coronavirus was never detected in the major Chinese cities of Beijing and Shanghai	0	AFP FactCheck	ASIA-PACIFIC	12 April 2020	https://factcheck.afp.com/false-claim-beijing-and-shanghai-are-untouched-covid-19		
77	Singapore introduced fines of up to SGD$150 for anyone not wearing a face mask outdoors during the COVID-19 pandemic.	0	AFP FactCheck	ASIA-PACIFIC	20 April 2020	https://factcheck.afp.com/misinformation-about-fines-singapore-circulated-online-face-masks-made-mandatory-public		
78	Australian supermarkets banned Chinese nationals during COVID-19 pandemic.	0	AFP FactCheck	ASIA-PACIFIC	19 April 2020	https://factcheck.afp.com/myth-spreads-online-australian-supermarkets-have-banned-chinese-nationals-during-covid-19-pandemic		
79	The secretary of Pope Francis held a “blessing ceremony” for US President Trump at the White House during the COVID-19 pandemic.	0	AFP FactCheck	ASIA-PACIFIC	15 April 2020	https://factcheck.afp.com/video-shows-president-trump-us-pastor-white-house-event-september-2017		
80	The Indian government outlawed social media posts about the novel coronavirus pandemic through a piece of national legislation called the Disaster Management Act.	0	AFP FactCheck	ASIA-PACIFIC	15 April 2020	https://factcheck.afp.com/new-hoax-circulates-online-india-has-outlawed-social-media-posts-about-covid-19		
81	COVID-19 is linked to the global rollout of 5G networks	0	AFP FactCheck	ASIA-PACIFIC	24 April 2020	https://factcheck.afp.com/no-evidence-5g-radiation-harmful-human-health-experts-say		
82	Wearing a face mask for an extended period of time could cause hypercapnia, a condition caused by a buildup of carbon dioxide in the blood.	0	AFP FactCheck	ASIA-PACIFIC	14 May 2020	https://factcheck.afp.com/myth-circulates-online-prolonged-use-face-masks-can-cause-hypercapnia		
83	Flu vaccines can make people more vulnerable to infections.	0	AFP FactCheck	ASIA-PACIFIC	11 May 2020	https://factcheck.afp.com/misleading-claim-circulates-flu-vaccines-make-people-more-vulnerable-infections		
84	The World Health Organization (WHO) reported that no vegetarian has contracted the novel coronavirus.	0	AFP FactCheck	ASIA-PACIFIC	08 May 2020	https://factcheck.afp.com/hoax-circulates-not-single-vegetarian-has-contracted-covid-19-according-who		
85	COVID-19 means “see a sheep surrender” in Latin.	0	AFP FactCheck	ASIA-PACIFIC	23 June 2020	https://factcheck.afp.com/hoax-circulates-about-latin-translation-covid-19		
86	"A banner displaying the words ""FIGHT TO WIN"" was erected by China in the Indian territory of Ladakh."	0	AFP FactCheck	ASIA-PACIFIC	18 June 2020	https://factcheck.afp.com/photo-has-circulated-reports-2012-about-indian-army-banner-ladakh		
87	Android users in Australia have been automatically signed up to COVIDSafe, the government's COVID-19 contact tracing app, through an application programming interface (API) operated by Google.	0	AFP FactCheck	ASIA-PACIFIC	17 June 2020	https://factcheck.afp.com/false-claim-circulates-android-users-australia-have-been-automatically-signed-covidsafe-app		
88	Australian Prime Minister Scott Morrison posted a tweet claiming that he is “glad we don’t have any racism here in Australia”.	0	AFP FactCheck	ASIA-PACIFIC	09 June 2020	https://factcheck.afp.com/misinformation-circulates-after-parody-account-australian-prime-minister-scott-morrison-tweets-about		
89	"A herbal drink made from a ""snake grass"" plant, also known as ""clinacanthus nutans"", can kill cancer cells ""in 24 hours""."	0	AFP FactCheck	ASIA-PACIFIC	14 July 2020	https://factcheck.afp.com/there-no-evidence-snake-grass-can-kill-cancer-cells-experts-say		
90	Hong Kong actor Jackie Chan offered cash handouts to people affected by the COVID-19 pandemic.	0	AFP FactCheck	ASIA-PACIFIC	13 July 2020	https://factcheck.afp.com/hoax-circulates-facebook-jackie-chan-offering-cash-handouts-during-covid-19-pandemic		
91	"Drinking coconut water diluted with potassium aluminium sulphate, a chemical compound commonly used in water purification, can ""dissolve kidney stones"". "	0	AFP FactCheck	ASIA-PACIFIC	17 July 2020	https://factcheck.afp.com/misinformation-recirculates-online-thailand-about-cure-kidney-stones		
92	Thermometer guns cause “damage” to the brain because they contain infrared radiation.	0	AFP FactCheck	ASIA-PACIFIC	23 July 2020	https://factcheck.afp.com/thermometer-guns-are-safe-use-health-experts-say		
93	"US space agency NASA has added a 13th star sign named ""Ophiuchus"" to the zodiac."	0	AFP FactCheck	ASIA-PACIFIC	22 July 2020	https://factcheck.afp.com/old-hoax-resurfaces-online-about-nasa-adding-13th-zodiac-sign-ophiuchus		
94	Face masks can cause fungal lung infections.	0	AFP FactCheck	ASIA-PACIFIC	02 September 2020	https://factcheck.afp.com/face-masks-do-not-cause-fungal-lung-infections-if-handled-correctly-health-experts-say		
